First Name,Middle Name,Last Name,Adhaar no ,address1,address2,Taluk,pincode
Arun,Tilip,Kumar,765492301856,veltech college,123 Main St.,Anantapur,110001
Bharathi,Aravind,Balakrishnan,934015678902,"57, Ashok Nagar, Bapuji Nagar",456 Park Ave.,Chikmagalur,560001
Devaraj,Balaji,Chidambaram,128760934512,"24, Subhashpuri, Adarsh Nagar",789 Elm St.,Coimbatore,400001
Dhilak,Chandran,Devendran,357291640829,"6/29, Rajiv Gandhi Nagar, Shanti Nagar",101 Oak Rd.,Davanagere,600001
Kaarthik,Dinesh,Elangovan,289043516707,"36, Ravi Vihar, Bhagat Singh Colony",234 Pine St.,Erode,700001
Gokul,Easwaran,Govindarajan,584139270145,"45, Krishna Nagar, Gopalpura Bypass",567 Maple Ave.,Guntur,208001
Harish,Ganesh,Harikrishnan,702495813476,"14, Shivaji Colony, Rajgarh",890 Cedar St.,Hassan,382445
Jagan,Hariharan,Iyer,356891240562,"3, Patel Nagar, Gomti Nagar",1111 Willow Dr.,Hubli,682016
Karthikeyan,Immanuel,Jeyakumar,208471965318,"18, Nehru Nagar, Mahalaxmi Nagar",2222 Juniper Ln.,Kancheepuram,413001
Manikandan,Jayaraman,Kannan,978560432187,"67, Gandhi Road, Kumhrar",3333 Birch Rd.,Karur,641001
Naren,Karthik,Lakshman,710935824689,"32, Ram Nagar, BHEL Township",4444 Ash St.,Kurnool,761001
Pradeep,Lakshmanan,Mahalingam,413257986102,"9, Nai Sadak, Shyam Nagar",5555 Spruce Ave.,Madurai,302001
Raghav,Madhavan,Narasimhan,692047381560,"21, Shastri Nagar, Gangapur City",6666 Chestnut St.,Mysore,713301
Sanjay,Narayanan,Pandian,167904235890,"48, Mahaveer Nagar, Gopalpura Bypass",7777 Redwood Dr.,Namakkal,560102
Saravanan,Prakash,Ranganathan,903271458036,"5, Janpath Lane, Sanganer",8888 Laurel Rd.,Nellore,110092
Selvakumar,Ramanathan,Sankaran,512874093275,"11, Vaishali Nagar, Vidhyadhar Nagar",9999 Cypress Ave.,Palakkad,144205
Senthil,Sampath,Sivakumar,746209358024,"23, Malviya Nagar, Civil Lines",1212 Magnolia Blvd.,Salem,641048
Siva,Sankar,Sundaram,270863941568,"8, Rambagh Circle, C Scheme",2323 Cedarwood Way,Shimoga,422003
Surya,Senthil Kumar,Thangavelu,680315729461,"15, Pratap Nagar, Nirman Nagar",3434 Oakdale Ave.,Sivagangai,585401
Tharun,Shanmugam,Udayakumar,345692781036,"29, Kirti Nagar, Tilak Nagar",4545 Pinehurst Dr.,Thanjavur,500034
Venkat,Subramanian,Venkataraman,901436782540,"7, Patel Marg, Malviya Nagar",5656 Maplewood Rd.,Tirunelveli,125001
Vignesh,Tamil,Vijayan,210876543210,"62, Raja Park, Jhotwara",6767 Sycamore Ln.,Tiruppur,781005
Vikram,Udayakumar,Viswanathan,620934176480,"41, Shyam Nagar, Vaishali Nagar",7878 Ashford Ave.,Trichy,700061
Vishal,Venkatesh,Xavier,745903124680,"17, Geeta Bhawan, Mahaveer Nagar",8989 Willowbrook Dr.,Udupi,751001
Yogesh,Vimal,Yesudian,124680935702,"52, Mahavir Nagar, Nai Basti",9090 Chestnut Hill Rd.,Vellore,695014
,Xavier,Zahirullah,,"30, Sunder Nagar, Ashok Nagar",